{
  "name": "landing page",
  "slug": "landing-page",
  "title": "amazing landing page",
  "type": "",
  "description": "Junglestar is a small, flexible, web agency. We deal with information architecture, screen design, code and deploy. We offer landing page websites at a competitive prices.",
  "permalink": "/offer/landing-page",
  "question": "&quot;Need website.<br>How much?&quot;",
  "publish": true,
  "bestseller": false,
  "bestvalue": true,
  "product": {
    "group": "design",
    "name": "Compact Website",
    "type": "All-included package",
    "subname": "Quality landing page template. Name, Hosting and Security included.",
    "desc": "We load your infos & produce a clean landing page ready to hit. The perfect digital brochure with zero maintenance cost!",
    "starting_at": "590",
    "starting_at_rp": "4.900.000",
    "starting_at_agent": "3.900.000",
    "agent_gets": "1.000.000",
    "demo_url": "https://amazing-single.junglestar.org/"
  },
  "selling_points": {
    "sp01": "Complete landing page.",
    "sp02": "Social media friendly.",
    "sp03": "SEO optimised.",
    "sp04": "Domain name.",
    "sp05": "Hosting on global CDN.",
    "sp06": "Secure SSL/https.",
    "sp07": "Sustainable Web Design."
  }
}
