{
  "name": "full site",
  "slug": "full-site",
  "title": "amazing full site",
  "type": "",
  "description": "We are a small, flexible, web agency. We craft information architecture, screen design, write code and deploy it. We offer full website solutions all-included.",
  "permalink": "/offer/full-site",
  "question": "&quot;I need a website and<br>I have questions...&quot;",
  "publish": true,
  "bestseller": true,
  "bestvalue": false,
  "product": {
    "group": "design",
    "name": "Amazing Website",
    "type": "All-included package",
    "subname": "Quality website template. Name, Hosting and Security included.",
    "desc": "We load your look and products data, process everything and produce a clean performant website ready to compete.",
    "starting_at": "990",
    "starting_at_rp": "9.900.000",
    "starting_at_agent": "7.900.000",
    "agent_gets": "2.000.000",
    "demo_url": "https://amazing-days.junglestar.org/"
  },
  "selling_points": {
    "sp01": "Full multipage website.",
    "sp02": "Social media friendly.",
    "sp03": "SEO optimised.",
    "sp04": "Domain name.",
    "sp05": "Hosting on global CDN.",
    "sp06": "Secure SSL/https.",
    "sp07": "Data entry.",
    "sp08": "Editing system for staff.",
    "sp09": "Sustainable Web Design."
  }
}
