{
  "name": "custom",
  "slug": "custom",
  "title": "amazing custom design",
  "type": "",
  "description": "We are a small, flexible, web agency. We offer top quality custom designed websites at reasonable prices. We grow relationships with clients.",
  "permalink": "/offer/custom",
  "question": "&quot;Yes I want this,<br>that and also...&quot;",
  "publish": true,
  "bestseller": false,
  "bestvalue": false,
  "product": {
    "group": "design",
    "name": "Awesome Design",
    "type": "All-included package",
    "subname": "Custom design. Fit to your needs. Name, Hosting and Security included.",
    "desc": "We craft a custom design for your brand &  produce a well thought browsing experience by embracing your existing look and brand identity.",
    "starting_at": "3.990",
    "starting_at_rp": "14.900.000",
    "starting_at_agent": "11.900.000",
    "agent_gets": "3.000.000",
    "demo_url": "https://binocle.it/?ref=junglestar"
  },
  "selling_points": {
    "sp01": "Full multipage website.",
    "sp02": "Social media friendly.",
    "sp03": "SEO optimised.",
    "sp04": "Domain name.",
    "sp05": "Hosting on global CDN.",
    "sp06": "Secure SSL/https.",
    "sp07": "Data entry.",
    "sp08": "Editing system for staff.",
    "sp09": "Custom design",
    "sp10": "Your Company look & feel!",
    "sp11": "Sustainable Web Design."
  }
}
